{
  "author": {
    "displayName": "polen",
    "handle": "polen_ball",
    "nativeId": "1325353249008877569",
    "url": "https://x.com/polen_ball"
  },
  "collection": {
    "collector": "fxtwitter",
    "collectorVersion": "0.2.0",
    "runId": "run:x-discussion:2089362325619007865:2026-08-18T12:26:51+00:00",
    "seedPostId": "2089362325619007865"
  },
  "contentHash": "868f06db033fbc66ae8994f898a1c53086600cc8edce94a41aaf718c5d32f28e",
  "engagement": {
    "likes": 5,
    "replies": 0,
    "reposts": 0,
    "views": 434
  },
  "id": "src:x:2089381255548997641",
  "language": "en",
  "metadata": {
    "mediaCount": 0,
    "possiblySensitive": null
  },
  "nativeId": "2089381255548997641",
  "platform": "x",
  "publishedAt": "2026-08-17T15:58:04+00:00",
  "relations": [
    {
      "targetSourceId": "src:x:2089380080489295986",
      "type": "replies_to"
    }
  ],
  "retrievedAt": "2026-08-18T12:26:51+00:00",
  "schemaVersion": "0.1.0",
  "sourceType": "social_post",
  "text": "@PespoTeski I'm sorry...",
  "url": "https://x.com/polen_ball/status/2089381255548997641"
}
