{
  "author": {
    "displayName": "Puck Burberk",
    "handle": "estrogenyum",
    "nativeId": "1905093100600799232",
    "url": "https://x.com/estrogenyum"
  },
  "collection": {
    "collector": "fxtwitter",
    "collectorVersion": "0.2.0",
    "runId": "run:x-discussion:2089362325619007865:2026-08-18T12:26:51+00:00",
    "seedPostId": "2089362325619007865"
  },
  "contentHash": "204aa679712dacbcf1c083fdc845a74a6d9160fb7e794be7f124fa6cbca86418",
  "engagement": {
    "likes": 0,
    "replies": 0,
    "reposts": 0,
    "views": 17
  },
  "id": "src:x:2089478843144740946",
  "language": "en",
  "metadata": {
    "mediaCount": 0,
    "possiblySensitive": null
  },
  "nativeId": "2089478843144740946",
  "platform": "x",
  "publishedAt": "2026-08-17T22:25:51+00:00",
  "relations": [
    {
      "targetSourceId": "src:x:2089362325619007865",
      "type": "quotes"
    }
  ],
  "retrievedAt": "2026-08-18T12:26:51+00:00",
  "schemaVersion": "0.1.0",
  "sourceType": "social_post",
  "text": "Yeah this was always a thing for me \nNever let anyone tell you trans kids dont exist I refused to be seen toppess and would cry myself to sleep wishing I was a girl and I had never even heard of a trans person until I was like 15-16",
  "url": "https://x.com/estrogenyum/status/2089478843144740946"
}
