{
  "author": {
    "displayName": "HazelnutFox🦊🏳️‍⚧️",
    "handle": "Haze1nutF0x",
    "nativeId": "1029042901714710528",
    "url": "https://x.com/Haze1nutF0x"
  },
  "collection": {
    "collector": "fxtwitter",
    "collectorVersion": "0.2.0",
    "runId": "run:x-discussion:2089362325619007865:2026-08-18T12:26:51+00:00",
    "seedPostId": "2089362325619007865"
  },
  "contentHash": "0b7e719de49592dd356dd51c1241fe2014a93d99892a3bdbe1444e416897c159",
  "engagement": {
    "likes": 8,
    "replies": 0,
    "reposts": 0,
    "views": 251
  },
  "id": "src:x:2089455882773954661",
  "language": "en",
  "metadata": {
    "mediaCount": 0,
    "possiblySensitive": null
  },
  "nativeId": "2089455882773954661",
  "platform": "x",
  "publishedAt": "2026-08-17T20:54:37+00:00",
  "relations": [
    {
      "targetSourceId": "src:x:2089362325619007865",
      "type": "replies_to"
    }
  ],
  "retrievedAt": "2026-08-18T12:26:51+00:00",
  "schemaVersion": "0.1.0",
  "sourceType": "social_post",
  "text": "@polen_ball Yes\nI love restarted wearing quick dry shirts everywhere cause I always felt very uncomfortable not having something covering my chest",
  "url": "https://x.com/Haze1nutF0x/status/2089455882773954661"
}
