{
  "author": {
    "displayName": "🐧Veth🏳️‍⚧️🐧🍉",
    "handle": "RedPandaVeth",
    "nativeId": "839135697420300291",
    "url": "https://x.com/RedPandaVeth"
  },
  "collection": {
    "collector": "fxtwitter",
    "collectorVersion": "0.2.0",
    "runId": "run:x-discussion:2089362325619007865:2026-08-18T12:26:51+00:00",
    "seedPostId": "2089362325619007865"
  },
  "contentHash": "fa9bf9f21db7c4d8124fea4a8d23dac9eef12491b083063a872f97211a820f99",
  "engagement": {
    "likes": 11,
    "replies": 0,
    "reposts": 0,
    "views": 207
  },
  "id": "src:x:2089381435052327408",
  "language": "en",
  "metadata": {
    "mediaCount": 0,
    "possiblySensitive": null
  },
  "nativeId": "2089381435052327408",
  "platform": "x",
  "publishedAt": "2026-08-17T15:58:47+00:00",
  "relations": [
    {
      "targetSourceId": "src:x:2089362325619007865",
      "type": "replies_to"
    }
  ],
  "retrievedAt": "2026-08-18T12:26:51+00:00",
  "schemaVersion": "0.1.0",
  "sourceType": "social_post",
  "text": "@polen_ball Before puberty I didn't care but after the idea of being topless was hell, even when I was alone.",
  "url": "https://x.com/RedPandaVeth/status/2089381435052327408"
}
