{
  "author": {
    "displayName": "Rubicuda",
    "handle": "Zekrov1",
    "nativeId": "1315171053233078272",
    "url": "https://x.com/Zekrov1"
  },
  "collection": {
    "collector": "fxtwitter",
    "collectorVersion": "0.2.0",
    "runId": "run:x-discussion:2089362325619007865:2026-08-18T12:26:51+00:00",
    "seedPostId": "2089362325619007865"
  },
  "contentHash": "4519263f7e3adfeb45c8ae213cb7aa3eae99f8dff8f834bcd63345cecb7e7fb6",
  "engagement": {
    "likes": 0,
    "replies": 0,
    "reposts": 0,
    "views": 9
  },
  "id": "src:x:2089570326883750384",
  "language": "en",
  "metadata": {
    "mediaCount": 0,
    "possiblySensitive": null
  },
  "nativeId": "2089570326883750384",
  "platform": "x",
  "publishedAt": "2026-08-18T04:29:22+00:00",
  "relations": [
    {
      "targetSourceId": "src:x:2089362325619007865",
      "type": "quotes"
    }
  ],
  "retrievedAt": "2026-08-18T12:26:51+00:00",
  "schemaVersion": "0.1.0",
  "sourceType": "social_post",
  "text": "i used to go swimming with a shirt on because of this actually\n#SoggyShirtGang",
  "url": "https://x.com/Zekrov1/status/2089570326883750384"
}
