{
  "author": {
    "displayName": "Kara Augustine 🫶🏻🩵",
    "handle": "RedLipClsicKara",
    "nativeId": "3699457035",
    "url": "https://x.com/RedLipClsicKara"
  },
  "collection": {
    "collector": "fxtwitter",
    "collectorVersion": "0.2.0",
    "runId": "run:x-discussion:2089362325619007865:2026-08-18T12:26:51+00:00",
    "seedPostId": "2089362325619007865"
  },
  "contentHash": "e6cac3d457f151907dc941abffdb90a81e4f671f44401879123fe73575c4e795",
  "engagement": {
    "likes": 0,
    "replies": 0,
    "reposts": 0,
    "views": 150
  },
  "id": "src:x:2089540411974906282",
  "language": "en",
  "metadata": {
    "mediaCount": 0,
    "possiblySensitive": null
  },
  "nativeId": "2089540411974906282",
  "platform": "x",
  "publishedAt": "2026-08-18T02:30:30+00:00",
  "relations": [
    {
      "targetSourceId": "src:x:2089362325619007865",
      "type": "quotes"
    }
  ],
  "retrievedAt": "2026-08-18T12:26:51+00:00",
  "schemaVersion": "0.1.0",
  "sourceType": "social_post",
  "text": "yeah I always wore swim shirts cause I hated how I looked and people always said “you’ve gotta put some meat on those bones”",
  "url": "https://x.com/RedLipClsicKara/status/2089540411974906282"
}
