{
  "author": {
    "displayName": "polen",
    "handle": "polen_ball",
    "nativeId": "1325353249008877569",
    "url": "https://x.com/polen_ball"
  },
  "collection": {
    "collector": "fxtwitter",
    "collectorVersion": "0.2.0",
    "runId": "run:x-discussion:2089362325619007865:2026-08-18T12:26:51+00:00",
    "seedPostId": "2089362325619007865"
  },
  "contentHash": "59cf0f3991b9028c4d0173d686d728bf3cbc81a88ef1d488d4fbf025ff9f8dc7",
  "engagement": {
    "likes": 44,
    "replies": 1,
    "reposts": 2,
    "views": 3982
  },
  "id": "src:x:2089363925532062122",
  "language": "en",
  "metadata": {
    "mediaCount": 0,
    "possiblySensitive": null
  },
  "nativeId": "2089363925532062122",
  "platform": "x",
  "publishedAt": "2026-08-17T14:49:13+00:00",
  "relations": [
    {
      "targetSourceId": "src:x:2089363153524072713",
      "type": "replies_to"
    }
  ],
  "retrievedAt": "2026-08-18T12:26:51+00:00",
  "schemaVersion": "0.1.0",
  "sourceType": "social_post",
  "text": "@Innerste_ Lowkey I would feel rly uncomfortable and then I'd go into the water and forget about it cuz it's not like I could explain to my parents why I needed a shirt considering that I didn't have a reason myself, so I kind of accepted it",
  "url": "https://x.com/polen_ball/status/2089363925532062122"
}
