{
  "author": {
    "displayName": "MystSL",
    "handle": "mystsl",
    "nativeId": "1941590052649435136",
    "url": "https://x.com/mystsl"
  },
  "collection": {
    "collector": "fxtwitter",
    "collectorVersion": "0.2.0",
    "runId": "run:x-discussion:2089362325619007865:2026-08-18T12:26:51+00:00",
    "seedPostId": "2089362325619007865"
  },
  "contentHash": "21793e0884acf8c8d52ba893fa813d253acad8d4ec708119be8e081d2766a74f",
  "engagement": {
    "likes": 3,
    "replies": 0,
    "reposts": 0,
    "views": 78
  },
  "id": "src:x:2089402246085636383",
  "language": "en",
  "metadata": {
    "mediaCount": 0,
    "possiblySensitive": null
  },
  "nativeId": "2089402246085636383",
  "platform": "x",
  "publishedAt": "2026-08-17T17:21:29+00:00",
  "relations": [
    {
      "targetSourceId": "src:x:2089362325619007865",
      "type": "replies_to"
    }
  ],
  "retrievedAt": "2026-08-18T12:26:51+00:00",
  "schemaVersion": "0.1.0",
  "sourceType": "social_post",
  "text": "@polen_ball @MisbegottenFool I used to get made fun of/get weird looks specifically for the fact I’ll never go shirtless at a pool and wrap my towel around above my chest, I’m a cis guy but I can at least relate to that",
  "url": "https://x.com/mystsl/status/2089402246085636383"
}
