{
  "author": {
    "displayName": "Aubrey 🏳️‍⚧️",
    "handle": "topten10fish",
    "nativeId": "2021945334495064064",
    "url": "https://x.com/topten10fish"
  },
  "collection": {
    "collector": "fxtwitter",
    "collectorVersion": "0.2.0",
    "runId": "run:x-discussion:2089362325619007865:2026-08-18T12:26:51+00:00",
    "seedPostId": "2089362325619007865"
  },
  "contentHash": "e7187c6795063f970ff5dbd98dcd1d945a4b3a49ec8dae7d82f5e8886d99809b",
  "engagement": {
    "likes": 6,
    "replies": 1,
    "reposts": 1,
    "views": 94
  },
  "id": "src:x:2089472970615849284",
  "language": "pt",
  "metadata": {
    "mediaCount": 0,
    "possiblySensitive": null
  },
  "nativeId": "2089472970615849284",
  "platform": "x",
  "publishedAt": "2026-08-17T22:02:31+00:00",
  "relations": [
    {
      "targetSourceId": "src:x:2089362325619007865",
      "type": "quotes"
    }
  ],
  "retrievedAt": "2026-08-18T12:26:51+00:00",
  "schemaVersion": "0.1.0",
  "sourceType": "social_post",
  "text": "truth supernova",
  "url": "https://x.com/topten10fish/status/2089472970615849284"
}
