{
  "author": {
    "displayName": "𝗗𝗮𝘃",
    "handle": "Based_d0ll",
    "nativeId": "55094990",
    "url": "https://x.com/Based_d0ll"
  },
  "collection": {
    "collector": "fxtwitter",
    "collectorVersion": "0.2.0",
    "runId": "run:x-discussion:2089362325619007865:2026-08-18T12:26:51+00:00",
    "seedPostId": "2089362325619007865"
  },
  "contentHash": "2db0a08cf4797573637fef5b809c14938d93b5717838f5cf3cdd48c37b3b1aa0",
  "engagement": {
    "likes": 3,
    "replies": 1,
    "reposts": 0,
    "views": 126
  },
  "id": "src:x:2089407870202757366",
  "language": "en",
  "metadata": {
    "mediaCount": 0,
    "possiblySensitive": null
  },
  "nativeId": "2089407870202757366",
  "platform": "x",
  "publishedAt": "2026-08-17T17:43:50+00:00",
  "relations": [
    {
      "targetSourceId": "src:x:2089362325619007865",
      "type": "replies_to"
    }
  ],
  "retrievedAt": "2026-08-18T12:26:51+00:00",
  "schemaVersion": "0.1.0",
  "sourceType": "social_post",
  "text": "@polen_ball Oui, I would always find an excuse to wear a rash guard or shirt",
  "url": "https://x.com/Based_d0ll/status/2089407870202757366"
}
