{
  "author": {
    "displayName": "Arctic",
    "handle": "neco_arctic",
    "nativeId": "956500987614646273",
    "url": "https://x.com/neco_arctic"
  },
  "collection": {
    "collector": "fxtwitter",
    "collectorVersion": "0.2.0",
    "runId": "run:x-discussion:2089362325619007865:2026-08-18T12:26:51+00:00",
    "seedPostId": "2089362325619007865"
  },
  "contentHash": "f2f0917b19bc780120f4ec608886d182a2695acb11c16c8ec7ea54b7f76ed3a6",
  "engagement": {
    "likes": 6,
    "replies": 0,
    "reposts": 0,
    "views": 121
  },
  "id": "src:x:2089383389417918816",
  "language": "en",
  "metadata": {
    "mediaCount": 0,
    "possiblySensitive": null
  },
  "nativeId": "2089383389417918816",
  "platform": "x",
  "publishedAt": "2026-08-17T16:06:33+00:00",
  "relations": [
    {
      "targetSourceId": "src:x:2089362325619007865",
      "type": "replies_to"
    }
  ],
  "retrievedAt": "2026-08-18T12:26:51+00:00",
  "schemaVersion": "0.1.0",
  "sourceType": "social_post",
  "text": "@polen_ball Oh yeah I felt intense sensations of shame at the pool and I really couldn't place why",
  "url": "https://x.com/neco_arctic/status/2089383389417918816"
}
