{
  "author": {
    "displayName": "TescoPespsi ミヤ 🏳️‍⚧️🇮🇪",
    "handle": "PespoTeski",
    "nativeId": "1927335280115101696",
    "url": "https://x.com/PespoTeski"
  },
  "collection": {
    "collector": "fxtwitter",
    "collectorVersion": "0.2.0",
    "runId": "run:x-discussion:2089362325619007865:2026-08-18T12:26:51+00:00",
    "seedPostId": "2089362325619007865"
  },
  "contentHash": "92b9d9a231d1b2685e7de47fd60ae7aaa61796ad9e7d1fd590c90dc6a3058f09",
  "engagement": {
    "likes": 9,
    "replies": 1,
    "reposts": 0,
    "views": 563
  },
  "id": "src:x:2089380080489295986",
  "language": "en",
  "metadata": {
    "mediaCount": 0,
    "possiblySensitive": null
  },
  "nativeId": "2089380080489295986",
  "platform": "x",
  "publishedAt": "2026-08-17T15:53:24+00:00",
  "relations": [
    {
      "targetSourceId": "src:x:2089366262703161361",
      "type": "replies_to"
    }
  ],
  "retrievedAt": "2026-08-18T12:26:51+00:00",
  "schemaVersion": "0.1.0",
  "sourceType": "social_post",
  "text": "@polen_ball No I just feel really dysphoric being forced to wear shorts normally I just heavily dislike it but last time I wore shorts I nearly had a public mental breakdown so that's kinda ruined them even more for me but at least I don't have to wear them too often in Ireland",
  "url": "https://x.com/PespoTeski/status/2089380080489295986"
}
