{
  "author": {
    "displayName": "ashyy!!",
    "handle": "ashyy_q",
    "nativeId": "1714610849577684992",
    "url": "https://x.com/ashyy_q"
  },
  "collection": {
    "collector": "fxtwitter",
    "collectorVersion": "0.2.0",
    "runId": "run:x-discussion:2089362325619007865:2026-08-18T12:26:51+00:00",
    "seedPostId": "2089362325619007865"
  },
  "contentHash": "8a3e6394308241259e3f3a62fd2640215264628590d7e1a8735cdd3bea9acb23",
  "engagement": {
    "likes": 12,
    "replies": 2,
    "reposts": 0,
    "views": 279
  },
  "id": "src:x:2089521698257395743",
  "language": "en",
  "metadata": {
    "mediaCount": 0,
    "possiblySensitive": null
  },
  "nativeId": "2089521698257395743",
  "platform": "x",
  "publishedAt": "2026-08-18T01:16:08+00:00",
  "relations": [
    {
      "targetSourceId": "src:x:2089362325619007865",
      "type": "quotes"
    }
  ],
  "retrievedAt": "2026-08-18T12:26:51+00:00",
  "schemaVersion": "0.1.0",
  "sourceType": "social_post",
  "text": "YES YES YES YES YES ME ME ME ME ME",
  "url": "https://x.com/ashyy_q/status/2089521698257395743"
}
