{
  "author": {
    "displayName": "motomami",
    "handle": "liberdoll",
    "nativeId": "1868536243216060416",
    "url": "https://x.com/liberdoll"
  },
  "collection": {
    "collector": "fxtwitter",
    "collectorVersion": "0.2.0",
    "runId": "run:x-discussion:2089362325619007865:2026-08-18T12:26:51+00:00",
    "seedPostId": "2089362325619007865"
  },
  "contentHash": "e83d3124b8d7b2bb9d160f6eda90374e2c6299cbf33e5865041c645eb147b337",
  "engagement": {
    "likes": 2,
    "replies": 0,
    "reposts": 1,
    "views": 163
  },
  "id": "src:x:2089649709661016562",
  "language": null,
  "metadata": {
    "mediaCount": 0,
    "possiblySensitive": null
  },
  "nativeId": "2089649709661016562",
  "platform": "x",
  "publishedAt": "2026-08-18T09:44:49+00:00",
  "relations": [
    {
      "targetSourceId": "src:x:2089362325619007865",
      "type": "quotes"
    }
  ],
  "retrievedAt": "2026-08-18T12:26:51+00:00",
  "schemaVersion": "0.1.0",
  "sourceType": "social_post",
  "text": "yup🤣",
  "url": "https://x.com/liberdoll/status/2089649709661016562"
}
