{
  "author": {
    "displayName": "Kuiper ⚧︎",
    "handle": "wolfgirldick",
    "nativeId": "2016234813456580610",
    "url": "https://x.com/wolfgirldick"
  },
  "collection": {
    "collector": "fxtwitter",
    "collectorVersion": "0.2.0",
    "runId": "run:x-discussion:2089362325619007865:2026-08-18T12:26:51+00:00",
    "seedPostId": "2089362325619007865"
  },
  "contentHash": "876ee2bd85546e370a9f288870e5a295b14c9237f4bb96030a7068d1833810a9",
  "engagement": {
    "likes": 7,
    "replies": 2,
    "reposts": 0,
    "views": 448
  },
  "id": "src:x:2089573863248322771",
  "language": "en",
  "metadata": {
    "mediaCount": 0,
    "possiblySensitive": null
  },
  "nativeId": "2089573863248322771",
  "platform": "x",
  "publishedAt": "2026-08-18T04:43:26+00:00",
  "relations": [
    {
      "targetSourceId": "src:x:2089362325619007865",
      "type": "quotes"
    }
  ],
  "retrievedAt": "2026-08-18T12:26:51+00:00",
  "schemaVersion": "0.1.0",
  "sourceType": "social_post",
  "text": "I BEGGED my dad for a swim shirt when I was a kid. and when I didnt have it I would just swim in T shirts or whatever I had. I also would occasionally play ultimate Frisbee with friends in high school and would damn near cry when I got picked for ths \"skins\" team.",
  "url": "https://x.com/wolfgirldick/status/2089573863248322771"
}
