{
  "author": {
    "displayName": "Soonfald 🏳️‍🌈🏳️‍⚧️",
    "handle": "Soonfald",
    "nativeId": "906872366",
    "url": "https://x.com/Soonfald"
  },
  "collection": {
    "collector": "fxtwitter",
    "collectorVersion": "0.2.0",
    "runId": "run:x-discussion:2089362325619007865:2026-08-18T12:26:51+00:00",
    "seedPostId": "2089362325619007865"
  },
  "contentHash": "4c4dce98630094db5ab95bfaa8af9af963ebff4876d55fc7bf2864c312ee7326",
  "engagement": {
    "likes": 1,
    "replies": 0,
    "reposts": 0,
    "views": 32
  },
  "id": "src:x:2089525927256666315",
  "language": "en",
  "metadata": {
    "mediaCount": 0,
    "possiblySensitive": null
  },
  "nativeId": "2089525927256666315",
  "platform": "x",
  "publishedAt": "2026-08-18T01:32:57+00:00",
  "relations": [
    {
      "targetSourceId": "src:x:2089362325619007865",
      "type": "quotes"
    }
  ],
  "retrievedAt": "2026-08-18T12:26:51+00:00",
  "schemaVersion": "0.1.0",
  "sourceType": "social_post",
  "text": "OMG YES\n\ni always felt... exposed without a shirt on. i wasn't really self-conscious about how my chest looked or anything, but i just never liked how being toppless felt.",
  "url": "https://x.com/Soonfald/status/2089525927256666315"
}
